<?xml version="1.0" encoding="UTF-8"?>
<!DOCTYPE timeslots SYSTEM "classSchedule.dtd">



<timeslots>
    <timeslot time="8:30">
        <booking day="Friday" startTime="8:30" endTime="10:20" instructor="Steve" classActivity="Lecture" classLocation="SW9-206" />
    </timeslot>
    <timeslot time="9:30">
        <booking day="Thursday" startTime="9:30" endTime="10:20" instructor="Richard" classActivity="Lecture" classLocation="SW5-1840" />
    </timeslot>
    <timeslot time="10:30">
        <booking day="Tuesday" startTime="10:30" endTime="12:20" instructor="Bethany" classActivity="Lab" classLocation="SE12-306" />
        <booking day="Wednesday" startTime="10:30" endTime="12:20" instructor="Steve" classActivity="Lab" classLocation="SE12-306" />
        <booking day="Thursday" startTime="10:30" endTime="12:20" instructor="Jim" classActivity="Lab" classLocation="SE12-320" />
    </timeslot>
    <timeslot time="11:30">
        <booking day="Tuesday" startTime="12:30" endTime="1:20" instructor="Medhat" classActivity="Lecture" classLocation="SW9-206" />
        <booking day="Wednesday" startTime="12:30" endTime="2:20" instructor="Jim" classActivity="Lecture" classLocation="SW3-1750" />
    </timeslot>
    <timeslot time="1:30">
        <booking day="Monday" startTime="1:30" endTime="3:20" instructor="Trevor" classActivity="Tutorial" classLocation="SE12-306" />
        <booking day="Tuesday" startTime="1:30" endTime="3:20" instructor="Medhat" classActivity="Lab" classLocation="SE12-306" />
        <booking day="Thursday" startTime="1:30" endTime="3:20" instructor="Richard" classActivity="Lab" classLocation="SE12-306" />
    </timeslot>
    <timeslot time="3:30">
        <booking day="Monday" startTime="3:30" endTime="4:20" instructor="Richard" classActivity="Lecture" classLocation="SW9-206" />
        <booking day="Tuesday" startTime="3:30" endTime="5:20" instructor="Bethany" classActivity="Lecture" classLocation="SW3-3615" />
    </timeslot>
    <timeslot time="4:30">
        <booking day="Monday" startTime="4:30" endTime="5:20" instructor="Medhat" classActivity="Lecture" classLocation="SE6-205" />
    </timeslot>
            
</timeslots>
